<?xml version="1.0" encoding="UTF-8"?>
<!DOCTYPE xygr SYSTEM "xygr.dtd">
<xygr xmlns="http://graph2svg.googlecode.com"
		pointType="circle" colorScheme="cold"
		axesPos="left-bottom"
		xAxisType="dateTime"> 
	<title>Test 15 seconds on X</title>

	<curve>
		<point x="2010-01-22T11:04:04" y="15"/>
		<point x="2010-01-22T11:04:10" y="12"/>
		<point x="2010-01-22T11:04:11" y="10"/>
		<point x="2010-01-22T11:04:12" y="13"/>
		<point x="2010-01-22T11:04:20" y="14"/>
	</curve>

</xygr>